{
  "_D": "urn:oasis:names:specification:ubl:schema:xsd:DigitalCapability-2",
  "_A": "urn:oasis:names:specification:ubl:schema:xsd:CommonAggregateComponents-2",
  "_B": "urn:oasis:names:specification:ubl:schema:xsd:CommonBasicComponents-2",
  "DigitalCapability": [
    {
      "UBLVersionID": [{ "_": "2.2" }],
      "ID": [{ "_": "C12345-2016" }],
      "IssueDate": [{ "_": "2016-11-07" }],
      "VersionID": [{ "_": "1.1" }],
      "PreviousVersionID": [{ "_": "1.0" }],
      "SenderParty": [
        {
          "EndpointID": [
            { "_": "1234567987654", "schemeID": "GLN", "schemeAgencyID": "9" }
          ],
          "PartyIdentification": [
            {
              "ID": [{ "_": "DK12345678", "schemeID": "DK:CVR" }]
            }
          ],
          "PartyName": [
            {
              "Name": [{ "_": "Papirøen Food ApS" }]
            }
          ],
          "PostalAddress": [
            {
              "StreetName": [{ "_": "Trangravsvej" }],
              "BuildingNumber": [{ "_": "12" }],
              "CityName": [{ "_": "Copenhagen" }],
              "Country": [
                {
                  "IdentificationCode": [{ "_": "DK" }]
                }
              ]
            }
          ]
        }
      ],
      "BusinessParty": [
        {
          "EndpointID": [
            { "_": "9994567987654", "schemeID": "GLN", "schemeAgencyID": "9" }
          ],
          "PartyIdentification": [
            {
              "ID": [{ "_": "IT01234567890", "schemeID": "IT:VAT" }]
            }
          ],
          "PartyName": [
            {
              "Name": [{ "_": "Slow Food Srl" }]
            }
          ],
          "PostalAddress": [
            {
              "CityName": [{ "_": "La Spezia" }],
              "Country": [
                {
                  "IdentificationCode": [{ "_": "IT" }]
                }
              ]
            }
          ]
        }
      ],
      "DigitalProcess": [
        {
          "ID": [{ "_": "urn:www.cenbii.eu:profile:bii05:ver2.0" }],
          "ProfileID": [{ "_": "BII" }],
          "DigitalCollaboration": [
            {
              "ID": [{ "_": "1" }],
              "SendingDigitalService": [
                {
                  "ID": [{ "_": "Invoice" }],
                  "CustomizationID": [
                    {
                      "_": "urn:www.cenbii.eu:transaction:biitrns010:ver2.0:extended:urn:www.peppol.eu:bis:peppol5a:ver2.0"
                    }
                  ],
                  "DigitalDocumentMetadata": [
                    {
                      "FormatID": [{ "_": "UBL" }],
                      "VersionID": [{ "_": "2.2" }],
                      "SchemaURI": [
                        {
                          "_": "urn:oasis:names:specification:ubl:schema:xsd:Invoice-2"
                        }
                      ],
                      "DocumentTypeCode": [
                        {
                          "_": "380",
                          "listAgencyID": "6",
                          "listID": "UN/ECE 1001"
                        }
                      ]
                    }
                  ],
                  "DigitalDeliveryChannel": [
                    {
                      "NetworkID": [{ "_": "OpenPEPPOL" }],
                      "ParticipantID": [
                        {
                          "_": "1234567987654",
                          "schemeAgencyID": "9",
                          "schemeID": "GLN"
                        }
                      ],
                      "TestIndicator": [{ "_": true }],
                      "DigitalMessageDelivery": [
                        {
                          "ProtocolID": [{ "_": "AS2" }],
                          "EndpointURI": [{ "_": "http://as2.papifood.dk" }]
                        }
                      ]
                    }
                  ]
                }
              ],
              "ReceivingDigitalService": [
                {
                  "ID": [{ "_": "CreditNote" }],
                  "CustomizationID": [
                    {
                      "_": "urn:www.cenbii.eu:transaction:biitrns014:ver2.0:extended:urn:www.peppol.eu:bis:peppol5a:ver2.0"
                    }
                  ],
                  "DigitalDocumentMetadata": [
                    {
                      "FormatID": [{ "_": "UBL" }],
                      "VersionID": [{ "_": "2.2" }],
                      "SchemaURI": [
                        {
                          "_": "urn:oasis:names:specification:ubl:schema:xsd:CreditNote-2"
                        }
                      ],
                      "DocumentTypeCode": [
                        {
                          "_": "381",
                          "listAgencyID": "6",
                          "listID": "UN/ECE 1001"
                        }
                      ]
                    }
                  ],
                  "DigitalDeliveryChannel": [
                    {
                      "NetworkID": [{ "_": "OpenPEPPOL" }],
                      "ParticipantID": [
                        {
                          "_": "1234567987654",
                          "schemeAgencyID": "9",
                          "schemeID": "GLN"
                        }
                      ],
                      "DigitalMessageDelivery": [
                        {
                          "ProtocolID": [{ "_": "AS2" }],
                          "EndpointURI": [{ "_": "http://as2.papifood.dk" }]
                        }
                      ]
                    }
                  ]
                }
              ]
            }
          ]
        }
      ]
    }
  ]
}
